<?xml version="1.0" encoding="UTF-8"?>
<!--
  - A list of all specifications associated with the V2 product family (and managed through the V2 specification tracker)
  - Sort order reflects the order specifications will appear in the drop-down
  - The primary (default) specification should have a key of 'core'
  -
  - WARNING: Don't *ever* change the key as you'll break old tracker specifications.  Leave the key the same and change the name only.
  -
  - Note: This list is currently incomplete/incorrect and is just for test purposes
  -->
<specifications xmlns:xsi="http://www.w3.org/2001/XMLSchema-instance" xsi:noNamespaceSchemaLocation="../schemas/specificationList.xsd">
	<specification key="core" name="V2.x Message Specification"/>
	<specification key="vtwoplus" name="V2+ Message Specification"/>
	<specification key="conformance" name="V2 Conformance Methodology"/>
	<specification key="vtwostdqc" name="V2 Base Standard Quality Criteria"/>
	<specification key="vtwoigqc" name="V2 Implementation Guide Quality Criteria"/>
	<specification key="vtwotofhir" name="V2 to FHIR"/>
	<specification key="ss" name="Syndromic Surveillance (US)"/>
	<specification key="bafd" name="Birth and Fetal Death Reporting (US)" deprecated="true"/>
	<specification key="vrdr" name="Vital Records Death Reporting (US)" deprecated="true"/>
	<specification key="cchd" name="Critical Congenital Heart Defect - CCHD (US)"/>
	<specification key="ehdi" name="Early Hearing Detection and Intervention - EHDI (US)"/>
	<specification key="dar" name="Diagnostic Audiology Reporting - DAR (US)"/>
	<specification key="imm" name="Immunization Messaging (US)"/>
	<specification key="loi" name="Laboratory Orders (LOI) (US)"/>
	<specification key="lri" name="Laboratory Results Interface (LRI) (US)"/>
	<specification key="edos" name="Laboratory Test Compendium (eDOS) (US)"/>
	<specification key="edos-aoe" name="Laboratory Test Compendium Ask at Order Entry (eDOS - AOE) (US)"/>
	<specification key="labvaluesets" name="V2.5.1 Laboratory Value Sets (US)"/>
	<specification key="elr" name="Electronic Lab Reporting to Public Health (ELR) (US)"/>
	<specification key="vmr-cds" name="Implementing the Virtual Medical Record for Clinical Decision Support (vMR-CDS)" deprecated="true"/>
</specifications>
